{
  "description": "Draft exact-closure bundle for FEAT-017's mature host-neutral planning workflow. It allocates the feature and its eight thin SR projections; implementation evidence, human consent, and validation remain governed by their existing Coherence paths.",
  "draft": true,
  "id": "FEAT-017",
  "label": "PLANNING-BOOTSTRAP dossier bundle",
  "members": [
    "feat:FEAT-017",
    "sr:SR-043",
    "sr:SR-044",
    "sr:SR-051",
    "sr:SR-052",
    "sr:SR-053",
    "sr:SR-054",
    "sr:SR-055",
    "sr:SR-065"
  ]
}
